{
  "identity": "provider-neutral-0008-backend-token-verify-20261010-r1",
  "state": "CONSUMED_BEFORE_REMOTE",
  "prepared_commit_sha": "25d28d0d9db1dbdf09be473f12faa0a443fb06b3",
  "workflow_sha256": "adad4d87e5e823b823c4fdccd033f854ef3de479a4e2ba4d245d0d0f08776a3f",
  "helper_sha256": "b2e3c257713ef1f11ce3fccd5282f5a4575878dc1bf3d03957c2f199167434bf",
  "plan_sha256": "efca7fbf8a0d7f2b800cc1d9e723d972c44303ea26f39d369c569b979eb8e039"
}
